{
  "animation": {
    "idle": {
      "name": "Parent Christmas Idle",
      "loop": false
    },
    "singUP": {
      "name": "Parent Up Note Dad",
      "loop": false
    },
    "singDOWN": {
      "name": "Parent Down Note Dad",
      "loop": false
    },
    "singLEFT": {
      "name": "Parent Left Note Dad",
      "loop": false
    },
    "singRIGHT": {
      "name": "Parent Right Note Dad",
      "loop": false
    },
    "singLEFT-alt": {
      "name": "Parent Left Note Mom",
      "loop": false
    },
    "singRIGHT-alt": {
      "name": "Parent Right Note Mom",
      "loop": false
    },
    "singUP-alt": {
      "name": "Parent Up Note Mom",
      "loop": false
    },
    "singDOWN-alt": {
      "name": "Parent Down Note Mom",
      "loop": false
    }
  },
  "offset": {
    "idle": [0,0],
    "singUP": [-47,24],
    "singRIGHT": [-1,-23],
    "singLEFT": [-30, 16],
    "singDOWN": [-31, -29],
    "singUP-alt": [-47, 24],
    "singRIGHT-alt": [-1, -24],
    "singLEFT-alt": [-30,15],
    "singDOWN-alt": [-30, -27]
  },
  "flipx": false,
  "enemyOffset": [-500,0],
  "like": "parents",
  "playAnim": "idle"
}
