{
  "animation": {
    "idle": {
      "name": "monster idle",
      "loop": true
    },
    "singUP": {
      "name": "monster up note",
      "loop": true
    },
    "singDOWN": {
      "name": "monster down",
      "loop": true
    },
    "singLEFT": {
      "name": "Monster left note",
      "loop": true
    },
    "singRIGHT": {
      "name": "Monster Right note",
      "loop": true
    }
  },
  "offset": {
    "idle": [0,0],
    "singUP": [-20,50],
    "singRIGHT": [-51,0],
    "singLEFT": [-30, 0],
    "singDOWN": [-30, -40]
  },
  "flipx": false,
  "enemyOffset": [0,100],
  "like": "monster",
  "playAnim": "idle"
}
