{
  "animation": {
    "idle": {
      "name": "BF IDLE",
      "loop": false
    },
    "singUP": {
      "name": "BF UP NOTE",
      "loop": false
    },
    "singDOWN": {
      "name": "BF DOWN NOTE",
      "loop": false
    },
    "singLEFT": {
      "name": "BF LEFT NOTE",
      "loop": false
    },
    "singRIGHT": {
      "name": "BF RIGHT NOTE",
      "loop": false
    },
    "singLEFTmiss": {
      "name": "BF LEFT MISS",
      "loop": false
    },
    "singRIGHTmiss": {
      "name": "BF RIGHT MISS",
      "loop": false
    },
    "singUPmiss": {
      "name": "BF UP MISS",
      "loop": false
    },
    "singDOWNmiss": {
      "name": "BF DOWN MISS",
      "loop": false
    }
  },
  "deadAnimation": {
    "firstDeath": {
      "name": "BF Dies pixel",
      "loop": false
    },
    "deathLoop": {
      "name": "Retry Loop",
      "loop": true
    },
    "deathConfirm": {
      "name": "RETRY CONFIRM",
      "loop": false
    },
    "singUP": {
      "name": "BF Dies pixel",
      "loop": false
    }
  },
  "offset": {
    "idle": [0,0],
    "singUP": [0,0],
    "singRIGHT": [0,0],
    "singLEFT": [0, 0],
    "singDOWN": [0, 0],
    "singUPmiss": [0,0],
    "singRIGHTmiss": [0, 0],
    "singLEFTmiss": [0,0],
    "singDOWNmiss": [0, 0]
  },
  "deadOffset": {
    "firstDeath": [0,0],
    "deathLoop": [-37,0],
    "deathConfirm": [-37,0]
  },
  "flipx": true,
  "enemyOffset": [0,350],
  "size": [-100,-100],
  "followCam": [-100,-100],
  "like": "bf-pixel",
  "isPixel": true,
  "playAnim": "idle"
}
