{
  "animation": {
    "idle": {
      "name": "Dad idle dance",
      "loop": true
    },
    "singUP": {
      "name": "Dad Sing Note UP",
      "loop": true
    },
    "singDOWN": {
      "name": "Dad Sing Note DOWN",
      "loop": true
    },
    "singLEFT": {
      "name": "Dad Sing Note LEFT",
      "loop": true
    },
    "singRIGHT": {
      "name": "Dad Sing Note RIGHT",
      "loop": true
    }
  },
  "offset": {
    "idle": [0,0],
    "singUP": [-6,50],
    "singRIGHT": [0,27],
    "singLEFT": [-10, 10],
    "singDOWN": [0, -30]
  },
  "flipx": false,
  "camOffset": [400,0],
  "like": "dad",
  "playAnim": "idle"
}
