{
  "animation": {
    "danceLeft": {
      "name": "spooky dance idle",
      "loop": false,
      "indices":[0,2,6],
      "fps": 12
    },
    "danceRight": {
      "name": "spooky dance idle",
      "loop": false,
      "indices":[8,10,12,14],
      "fps": 12
    },
    "singUP": {
      "name": "spooky UP NOTE",
      "loop": false
    },
    "singDOWN": {
      "name": "spooky DOWN note",
      "loop": false
    },
    "singLEFT": {
      "name": "note sing left",
      "loop": false
    },
    "singRIGHT": {
      "name": "spooky sing right",
      "loop": false
    }
  },
  "offset": {
    "danceLeft": [0,0],
    "danceRight": [0,0],
    "singUP": [-20,26],
    "singRIGHT": [-130,-7],
    "singLEFT": [130, -10],
    "singDOWN": [-50, -130]
  },
  "flipx": false,
  "enemyOffset": [0,200],
  "like": "spooky",
  "playAnim": "danceRight"
}
