{
  "animation": {
    "danceLeft": {
      "name": "GF Dancing Beat",
      "loop": false,
      "indices": [30,0,1,2,3,4,5,6,7,8,9,10,11,12,13,14]
    },
    "danceRight": {
      "name": "GF Dancing Beat",
      "loop": false,
      "indices": [15,16,17,18,19,20,21,22,23,24,25,26,27,28,29]
    },
    "cheer": {
      "name": "GF Cheer",
      "loop": false
    },
    "hairBlow": {
      "name": "GF Dancing Beat Hair blowing",
      "loop": false,
      "indices": [0,1,2,3]
    },
    "hairFall": {
      "name": "GF Dancing Beat Hair Landing",
      "loop": false,
      "indices": [0,1,2,3,4,5,6,7,8,9,10,11]
    },
    "singUP": {
      "name": "GF Up Note",
      "loop": false
    },
    "singDOWN": {
      "name": "GF Down Note",
      "loop": false
    },
    "singLEFT": {
      "name": "GF left note",
      "loop": false
    },
    "singRIGHT": {
      "name": "GF Right Note",
      "loop": false
    },
    "scared": {
      "name": "GF FEAR",
      "loop": false
    },
    "sad": {
      "name": "gf sad",
      "loop": false
    }
  },
  "offset": {
    "singUP": [0,4],
    "singRIGHT": [0,-20],
    "singLEFT": [0, -19],
    "singDOWN": [0, -20],
    "scared": [-2, -17],
    "cheer": [0,0],
    "sad": [-2,-2],
    "danceLeft": [0, -9],
    "danceRight": [0, -9],
    "hairBlow": [45, -8],
    "hairFall": [0, -9]
  },
  "flipx": false,
  "like": "gf",
  "playAnim": "danceRight"
}
