{
  "animation": {
    "danceLeft": {
      "name": "GF Dancing Beat Hair blowing CAR",
      "loop": false,
      "indices": [30,0,1,2,3,4,5,6,7,8,9,10,11,12,13,14]
    },
    "danceRight": {
      "name": "GF Dancing Beat Hair blowing CAR",
      "loop": false,
      "indices": [15,16,17,18,19,20,21,22,23,24,25,26,27,28,29]
    },
    "singUP": {
      "name": "GF Dancing Beat Hair blowing CAR",
      "loop": false,
      "indices": [0]
    }
  },
  "offset": {
    "danceLeft": [0, 0],
    "danceRight": [0, 0]
  },
  "flipx": false,
  "like": "gf-car",
  "playAnim": "danceRight"
}
