{
  "animation": {
    "idle": {
      "name": "Mom Idle",
      "loop": false
    },
    "singUP": {
      "name": "Mom Up Pose",
      "loop": false
    },
    "singDOWN": {
      "name": "MOM DOWN POSE",
      "loop": false
    },
    "singLEFT": {
      "name": "Mom Left Pose",
      "loop": false
    },
    "singRIGHT": {
      "name": "Mom Pose Left",
      "loop": false
    }
  },
  "offset": {
    "idle": [0,0],
    "singUP": [14,71],
    "singRIGHT": [10,-60],
    "singLEFT": [250, -23],
    "singDOWN": [20, -160]
  },
  "flipx": false,
  "like": "mom",
  "followCam": [150,0],
  "playAnim": "idle"
}
